{
  "entry": "webgpu-apple-m5-pro-macos26-chrome152-sg32-burst1-flush32-lookahead1",
  "family": "qwen3-4b-q4f16-1",
  "rows": [
    {
      "kind": "measured",
      "label": "Warm model and pipelines, fresh uncached prompts, K=1 + lookahead 1 + batch pass + submit every 32, under sustained background CPU load",
      "host": {
        "backend": "webgpu",
        "deviceType": "gpu",
        "browser": "Chrome 152.0.7977.77",
        "os": "macOS 26.6.2 (25G83)",
        "chip": "Apple M5 Pro",
        "gpu": "apple/metal-3",
        "gpuCores": 20,
        "memoryGB": 64,
        "f16TflopsMeasured": 5.69,
        "sameAsTarget": true
      },
      "date": "2026-09-06",
      "protocol": "interleaved-ab",
      "runs": 12,
      "warmup": 1,
      "statistic": "Median of twelve rotating paired observations; each observation resets KV state and uses a different prompt. Ratio is the median of per-round ratios against the live baseline case.",
      "warmDecodeMsPerToken": 12.7397,
      "tokensPerSecond": 78.5,
      "pairedSpeedup": {
        "baseline": "sibling entry webgpu-apple-m5-pro-macos26-chrome152-sg32-burst4-flush32 run live in the same rotation on its own bundle d36ca3f7 (K=4, batch pass, flush 32); 74.17 tok/s median in this run",
        "candidate": "same model, K=1, lookahead 1, batch pass, flush 32, on the shipped lookahead bundle 163177f1",
        "baselineMsPerToken": 13.4825,
        "candidateMsPerToken": 12.7397,
        "speedup": 1.063
      },
      "loadAvg": [
        18.4,
        37.5
      ],
      "outputSha256": null,
      "quality": {
        "freshPromptExact": "12/12 outputs byte-identical to the paired baseline case in the same round, and identical to the six fresh-prompt hashes the sibling entry lists against the published path, with equal completion-token counts (47, 16, 42, 23, 51, 19)",
        "pairedRatioQuartiles": [
          1.013,
          1.093
        ],
        "pairedRatioMad": 0.044,
        "pairedRatioRange": [
          1.005,
          1.133
        ],
        "pairedEndToEndSpeedup": 1.041,
        "ttftDeltaMs": 0.0,
        "bundleSwapAloneSpeedup": 1.008,
        "bundleSwapAloneQuartiles": [
          1.004,
          1.03
        ]
      },
      "notes": "12.7397 ms/token is the reciprocal of the measured 78.50 tokens/s median. Bundle swap alone (K=4/flush 32 on the lookahead bundle vs the shipped bundle, same run): 1.008x (1.004-1.030), confirming the two bundles are equivalent outside the lookahead path. A 4B decode step is roughly twice the GPU work of a 1.7B step, so the fixed per-burst cost the lookahead hides is a smaller fraction of the token, which is why this paired ratio (1.063x) is below the 1.7B sibling entry's 1.136x; treat that as an upper bound for a quiet machine, not a claim about a quiet number.",
      "source": "webnn-workbench@21e1e562b40fa551b9eeabffc092d54605f28989 docs/results.md (Qwen3-4B second pass: K=1 with GPU lookahead; Explicit record of this pass)"
    },
    {
      "kind": "measured",
      "label": "Lookahead variants on the lookahead bundle (K=1/K=2, lookahead 1/2) at the sibling's K=4 baseline, plus quality corpus, paired under sustained background CPU load",
      "host": {
        "backend": "webgpu",
        "deviceType": "gpu",
        "browser": "Chrome 152.0.7977.77",
        "os": "macOS 26.6.2 (25G83)",
        "chip": "Apple M5 Pro",
        "gpu": "apple/metal-3",
        "gpuCores": 20,
        "memoryGB": 64,
        "f16TflopsMeasured": 5.69,
        "sameAsTarget": true
      },
      "date": "2026-09-06",
      "protocol": "interleaved-ab",
      "runs": 16,
      "warmup": 1,
      "statistic": "Medians of per-round ratios against the live sibling-entry case: run A, 12 rounds (load 16-22), all cases on the lookahead bundle; quality corpus run C, 4 rounds (load 25-30).",
      "warmDecodeMsPerToken": null,
      "tokensPerSecond": null,
      "loadAvg": [
        16,
        30
      ],
      "outputSha256": null,
      "quality": {
        "freshPromptExact": "12/12 run-A outputs byte-identical to the paired live baseline case",
        "qualityCorpusExact": "16/16 quality outputs byte-identical to the sibling stack and equal to the sibling's four quality hashes",
        "k1Lookahead1Speedup": 1.058,
        "k1Lookahead1Quartiles": [
          1.011,
          1.08
        ],
        "k1Lookahead2Speedup": 1.022,
        "k1Lookahead2Quartiles": [
          1.01,
          1.069
        ],
        "k2Lookahead1Speedup": 1.009,
        "k2Lookahead1Quartiles": [
          0.992,
          1.039
        ],
        "mixedCorpusDecodeSpeedup": 1.104,
        "mixedCorpusDecodeQuartiles": [
          1.099,
          1.112
        ]
      },
      "notes": "Run A isolates the lookahead effect against the sibling's own K=4/flush-32 baseline, all cases on the lookahead bundle: K=1 lookahead 1 is the headline configuration; K=1 lookahead 2 and K=2 lookahead 1 are the two runner-up variants, both 12/12 byte-identical. Run C is the quality corpus (math/prose/code/low-margin prompts), decode-only mixed-corpus ratio.",
      "source": "webnn-workbench@21e1e562b40fa551b9eeabffc092d54605f28989 docs/results.md (Qwen3-4B second pass: K=1 with GPU lookahead; Explicit record of this pass)"
    }
  ],
  "baselines": {
    "siblingEntryLive": {
      "warmDecodeMsPerToken": 13.4825,
      "tokensPerSecond": 74.17,
      "notes": "webgpu-apple-m5-pro-macos26-chrome152-sg32-burst4-flush32 measured live as the baseline case of the headline run, on its own bundle d36ca3f7 (K=4, batch pass, flush 32)."
    }
  },
  "sources": [
    "webnn-workbench@21e1e562b40fa551b9eeabffc092d54605f28989 docs/results.md (Qwen3-4B second pass: K=1 with GPU lookahead (2026-09-06); Explicit record of this pass)"
  ],
  "caveat": "All absolutes were taken while unrelated work saturated the CPU. Lookahead hides CPU-side gaps behind GPU execution and a saturated CPU widens them, so the paired 1.063x is an upper bound for a quiet machine. A 4B decode step is roughly twice the GPU work of the 1.7B sibling entry's step, so the fixed per-burst cost the lookahead hides is a smaller fraction of the token; that is the reason this ratio is smaller than the 1.7B entry's 1.136x. No quiet-machine number or projection is claimed. As of this writing the workbench PR (OlehZhyhinas/webnn-workbench#16, branch qwen4-fable) that recorded this pass is not yet merged."
}
